item_id,subsystem,component,model_or_label_observed,quantity,function,required,substitutable,notes
PWR-001,Battery,Intelligent flight battery,"DJI TB47D, 4500 mAh, 99.90 Wh, 22.2 V, LiPo",1,Main field power source,yes,limited,"Main energy source for the HML-LiDAR prototype"
PWR-002,Battery interface,Battery holder / battery box,"DJI Matrice 100 battery interface",1,Mechanical and electrical battery interface,yes,limited,"Proprietary DJI Matrice 100 / TB47D interface"
PWR-003,Charger,AC battery charger,"DJI A14-100P1A, output 26.3 V, 3.83 A, 100 W",1,Charges TB47D battery outside the cave,yes,limited,"Not used during helmet-mounted operation"
PWR-004,Voltage conversion,DC-DC converter for LiDAR supply,"VGEPS 190 W DC-DC converter, input 24 V, output 19 V / 10 A",1,LiDAR-side regulated power supply,yes,limited,"Output voltage must be measured before connecting the LiDAR"
PWR-005,Voltage conversion,DC-DC converter for Raspberry Pi supply,"LANTIANRC DC-DC / BEC-type module, 5 V output pads visible",1,Raspberry Pi regulated 5 V power supply,yes,limited,"Output voltage and current capacity must be verified under load"
